{
  "schemaVersion": "protocol-lab.load-profile.v1",
  "id": "regression",
  "title": "Regression",
  "status": "stable",
  "purpose": "regression",
  "description": "Moderate-burden profile for implementation-owned regression runs. Longer than smoke, with more connections. Not publishable.\n",
  "durationSeconds": 15,
  "warmupSeconds": 5,
  "repetitions": 2,
  "http1": {
    "connections": 16,
    "concurrency": 16
  },
  "http2": {
    "connections": 16,
    "concurrency": 16,
    "streamsPerConnection": 10
  },
  "http3": {
    "connections": 16,
    "concurrency": 16,
    "streamsPerConnection": 10
  },
  "quic": {
    "connections": 8,
    "streamsPerConnection": 8
  },
  "evidence": {
    "minimumTier": "regression",
    "publishable": false
  },
  "artifacts": {
    "required": [
      "load.stdout.log",
      "load.stderr.log",
      "validation.json",
      "result.json"
    ],
    "optional": [
      "counters"
    ]
  }
}
