{
  "schemaVersion": "protocol-lab.load-profile.v1",
  "id": "tls-handshake-smoke",
  "title": "TLS 1.3 Full Handshake Smoke",
  "status": "experimental",
  "purpose": "smoke",
  "durationSeconds": 5,
  "warmupSeconds": 1,
  "repetitions": 1,
  "tls": {
    "connections": 1,
    "concurrency": 1,
    "handshakesPerConnection": 1,
    "applicationDataBytes": 0,
    "connectionTimeoutSeconds": 5
  },
  "evidence": {
    "minimumTier": "smoke",
    "publishable": false
  }
}
