{
  "schemaVersion": "protocol-lab.load-profile.v1",
  "id": "smoke",
  "title": "Smoke",
  "status": "stable",
  "purpose": "smoke",
  "description": "Minimal load profile for fast functional proof.",
  "durationSeconds": 5,
  "warmupSeconds": 0,
  "repetitions": 1,
  "http1": {
    "connections": 1,
    "concurrency": 1
  },
  "http2": {
    "connections": 1,
    "concurrency": 1,
    "streamsPerConnection": 1
  },
  "http3": {
    "connections": 1,
    "concurrency": 1,
    "streamsPerConnection": 1
  },
  "quic": {
    "connections": 1,
    "streamsPerConnection": 1
  },
  "evidence": {
    "minimumTier": "smoke",
    "publishable": false
  }
}
