{
  "schemaVersion": "protocol-lab.load-profile.v1",
  "id": "comparison",
  "title": "Comparison",
  "status": "stable",
  "purpose": "comparison",
  "description": "A repeatable comparison profile intended for implementation-owned non-publishable regression evidence. Not suitable for publishable benchmark claims.\n",
  "durationSeconds": 30,
  "warmupSeconds": 10,
  "cooldownSeconds": 5,
  "repetitions": 3,
  "http1": {
    "connections": 128,
    "concurrency": 128,
    "requestTimeoutSeconds": 10
  },
  "http2": {
    "connections": 128,
    "concurrency": 128,
    "streamsPerConnection": 100,
    "requestTimeoutSeconds": 10
  },
  "http3": {
    "connections": 128,
    "concurrency": 128,
    "streamsPerConnection": 100,
    "requestTimeoutSeconds": 10
  },
  "quic": {
    "connections": 32,
    "streamsPerConnection": 16,
    "streamBytes": 1024,
    "connectionTimeoutSeconds": 10,
    "idleTimeoutSeconds": 10
  },
  "evidence": {
    "minimumTier": "comparison",
    "publishable": false
  },
  "artifacts": {
    "required": [
      "load.stdout.log",
      "load.stderr.log",
      "result.json"
    ],
    "optional": [
      "counters"
    ]
  }
}
